{
  "schema_version": 1,
  "diagram_type": "sequence",
  "meta": {
    "title": "Edit 한 번의 여정 — 저장 시점 게이트",
    "quality_profile": "showcase",
    "column_fit": "spread",
    "viewBox": [
      1080,
      600
    ],
    "repository": {
      "url": "https://github.com/Gruci/claude-web-harness",
      "revision": "a14a17f83c61d736a9f6ead3e8c3e33f32df453f"
    },
    "views": [
      {
        "id": "pass",
        "label": "통과",
        "focus": [
          "claude",
          "edit",
          "hook",
          "runner",
          "gates"
        ],
        "note": "저장 → 훅 → 러너 → 게이트. 위반이 없으면 exit 0 으로 조용히 끝난다."
      },
      {
        "id": "block",
        "label": "차단과 관찰",
        "focus": [
          "hook",
          "trace",
          "claude"
        ],
        "note": "위반이면 exit 2 와 stderr 피드백, 그리고 관찰 한 줄이 남는다. 같은 턴에 고친다."
      }
    ]
  },
  "participants": [
    {
      "id": "claude",
      "type": "external",
      "label": "Claude Code",
      "sublabel": "세션"
    },
    {
      "id": "edit",
      "type": "external",
      "label": "Edit 툴",
      "sublabel": "파일 저장"
    },
    {
      "id": "hook",
      "type": "security",
      "label": "⑨ 훅",
      "sublabel": "check_file_rules",
      "sources": [
        {
          "path": ".claude/hooks/check_file_rules.py",
          "line": 1,
          "end_line": 12,
          "label": "main"
        },
        {
          "path": ".claude/hooks/_hookio.py",
          "label": "페이로드 읽기"
        }
      ]
    },
    {
      "id": "runner",
      "type": "backend",
      "label": "러너",
      "sublabel": "kernel.runner --file",
      "sources": [
        {
          "path": "kernel/runner.py",
          "line": 385,
          "end_line": 411,
          "label": "main"
        }
      ]
    },
    {
      "id": "gates",
      "type": "backend",
      "label": "게이트",
      "sublabel": "kernel/gates/",
      "sources": [
        {
          "path": "kernel/gates/core.py",
          "line": 64,
          "end_line": 80,
          "label": "파일 길이 상한"
        },
        {
          "path": "kernel/gates/md_style.py",
          "label": "MD 작성 규칙"
        }
      ]
    },
    {
      "id": "trace",
      "type": "messagebus",
      "label": "관찰 기록",
      "sublabel": "harness_trace.jsonl",
      "sources": [
        {
          "path": "kernel/trace.py",
          "line": 59,
          "end_line": 84,
          "label": "record"
        },
        {
          "path": "harness_trace.jsonl",
          "label": "샘플"
        }
      ]
    }
  ],
  "segments": [
    {
      "from": 150,
      "to": 330,
      "label": "저장·판정"
    },
    {
      "from": 340,
      "to": 520,
      "label": "피드백·재수정"
    }
  ],
  "messages": [
    {
      "id": "save",
      "from": "claude",
      "to": "edit",
      "y": 160,
      "label": "파일 저장"
    },
    {
      "id": "payload",
      "from": "edit",
      "to": "hook",
      "y": 200,
      "label": "PostToolUse 페이로드"
    },
    {
      "id": "run-file",
      "from": "hook",
      "to": "runner",
      "y": 240,
      "label": "--file <경로>",
      "variant": "emphasis"
    },
    {
      "id": "judge",
      "from": "runner",
      "to": "gates",
      "y": 280,
      "label": "판정"
    },
    {
      "id": "fails",
      "from": "gates",
      "to": "runner",
      "y": 320,
      "label": "[FAIL] 목록",
      "variant": "return"
    },
    {
      "id": "exit1",
      "from": "runner",
      "to": "hook",
      "y": 360,
      "label": "exit 1 + stdout",
      "variant": "return"
    },
    {
      "id": "observe",
      "from": "hook",
      "to": "trace",
      "y": 400,
      "label": "관찰 1줄",
      "variant": "dashed"
    },
    {
      "id": "feedback",
      "from": "hook",
      "to": "claude",
      "y": 440,
      "label": "exit 2 · stderr 피드백",
      "variant": "security"
    },
    {
      "id": "retry",
      "from": "claude",
      "to": "edit",
      "y": 480,
      "label": "고치고 다시 저장",
      "variant": "dashed"
    }
  ],
  "activations": [
    {
      "participant": "hook",
      "from": 190,
      "to": 450,
      "type": "security"
    },
    {
      "participant": "runner",
      "from": 230,
      "to": 370,
      "type": "backend"
    },
    {
      "participant": "gates",
      "from": 270,
      "to": 330,
      "type": "backend"
    }
  ],
  "cards": [
    {
      "dot": "cyan",
      "title": "작성 시점",
      "items": [
        "저장한 그 파일만 30초 안에 본다",
        "검사기 크래시는 위반이 아니다 — exit 1"
      ]
    },
    {
      "dot": "rose",
      "title": "차단",
      "items": [
        "exit 2 와 stderr 가 모델에게 돌아간다",
        "같은 세션의 같은 차단은 관찰 한 번만 남는다"
      ]
    }
  ]
}
